Value,Count,Numeric
"rumson, new jersey, united states","6,760",6760
"osório, rio grande do sul, brazil","6,757",6757
"salisbury, massachusetts, united states","6,757",6757
"hitchcock, texas, united states","6,755",6755
"fuzhou, fujian, china","6,751",6751
"magee, mississippi, united states","6,748",6748
"bellville, texas, united states","6,746",6746
"carl junction, missouri, united states","6,746",6746
"eureka springs, arkansas, united states","6,746",6746
"rogersville, missouri, united states","6,746",6746
"troutman, north carolina, united states","6,744",6744
"williston park, new york, united states","6,741",6741
"cachapoal, bio-bio, chile","6,740",6740
"jena, thuringia, germany","6,740",6740
"krugersdorp, gauteng, south africa","6,736",6736
"montpelier, ohio, united states","6,736",6736
"wyoming, minnesota, united states","6,732",6732
"araguaia, minas gerais, brazil","6,731",6731
"alpine, utah, united states","6,728",6728
"pleasant valley, new york, united states","6,723",6723
"teixeira de freitas, bahia, brazil","6,723",6723
"caçapava, sao paulo, brazil","6,722",6722
"venâncio aires, rio grande do sul, brazil","6,718",6718
"cruzeiro, sao paulo, brazil","6,716",6716
"osage beach, missouri, united states","6,712",6712
"monte mor, sao paulo, brazil","6,710",6710
"brookville, indiana, united states","6,709",6709
"sugar hill, georgia, united states","6,707",6707
"hartville, ohio, united states","6,706",6706
"polson, montana, united states","6,706",6706
"pleasant grove, alabama, united states","6,704",6704
"rusk, texas, united states","6,704",6704
"roscommon, michigan, united states","6,703",6703
"waupun, wisconsin, united states","6,703",6703
"golden valley, arizona, united states","6,698",6698
"duvall, washington, united states","6,697",6697
"opp, alabama, united states","6,693",6693
"franklin, new hampshire, united states","6,690",6690
"worthington, minnesota, united states","6,690",6690
"hefei, anhui, china","6,689",6689
"butler, missouri, united states","6,688",6688
"madison, north carolina, united states","6,681",6681
"fayetteville, pennsylvania, united states","6,678",6678
"liberty hill, texas, united states","6,677",6677
"elburn, illinois, united states","6,676",6676
"mansfield, pennsylvania, united states","6,676",6676
"coloma, michigan, united states","6,672",6672
"elizabethtown, north carolina, united states","6,670",6670
"porto ferreira, sao paulo, brazil","6,670",6670
"pawcatuck, connecticut, united states","6,667",6667
"timoteo, minas gerais, brazil","6,667",6667
"monee, illinois, united states","6,666",6666
"west branch, michigan, united states","6,666",6666
"twin lake, michigan, united states","6,665",6665
"camaquã, rio grande do sul, brazil","6,663",6663
"ledyard, connecticut, united states","6,656",6656
"bedford, bedfordshire, united kingdom","6,654",6654
"blanchester, ohio, united states","6,654",6654
"itauna, minas gerais, brazil","6,654",6654
"purcell, oklahoma, united states","6,653",6653
"cottbus, brandenburg, germany","6,652",6652
"puri, orissa, india","6,652",6652
"beavercreek, ohio, united states","6,651",6651
"farmingdale, new jersey, united states","6,649",6649
"vandalia, illinois, united states","6,649",6649
"roanoke, alabama, united states","6,648",6648
"rupert, idaho, united states","6,648",6648
"goianesia, goias, brazil","6,646",6646
"bremen, indiana, united states","6,644",6644
"glennville, georgia, united states","6,637",6637
"portland, connecticut, united states","6,637",6637
"chittenango, new york, united states","6,635",6635
"macon, missouri, united states","6,635",6635
"safi, marrakesh-safi, morocco","6,629",6629
"paulsboro, new jersey, united states","6,628",6628
"wauwatosa, wisconsin, united states","6,628",6628
"groton, massachusetts, united states","6,622",6622
"congers, new york, united states","6,621",6621
"plainfield, connecticut, united states","6,621",6621
"walhalla, south carolina, united states","6,619",6619
"white house, tennessee, united states","6,619",6619
"tinsukia, assam, india","6,617",6617
"mabelvale, arkansas, united states","6,615",6615
"presidente epitacio, sao paulo, brazil","6,615",6615
"sidney, montana, united states","6,615",6615
"fort white, florida, united states","6,614",6614
"brighton, tennessee, united states","6,609",6609
"walnutport, pennsylvania, united states","6,607",6607
"girard, pennsylvania, united states","6,606",6606
"henryetta, oklahoma, united states","6,606",6606
"trumann, arkansas, united states","6,604",6604
"perry, iowa, united states","6,600",6600
"birch run, michigan, united states","6,599",6599
"cedarhurst, new york, united states","6,597",6597
"hidalgo, texas, united states","6,596",6596
"timonium, maryland, united states","6,595",6595
"greenacres, florida, united states","6,594",6594
"ubá, minas gerais, brazil","6,591",6591
"middlebury, indiana, united states","6,588",6588
"proctorville, ohio, united states","6,588",6588
"sitka, alaska, united states","6,588",6588
"bellerose, new york, united states","6,586",6586
"bhatinda, punjab, india","6,586",6586
"lamesa, texas, united states","6,585",6585
"fort edward, new york, united states","6,584",6584
"mill creek, washington, united states","6,583",6583
"tyrone, georgia, united states","6,579",6579
"covington, washington, united states","6,578",6578
"palos park, illinois, united states","6,578",6578
"pauls valley, oklahoma, united states","6,578",6578
"marlow, oklahoma, united states","6,576",6576
"weybridge, surrey, united kingdom","6,574",6574
"alcoa, tennessee, united states","6,571",6571
"gansevoort, new york, united states","6,571",6571
"winchester, indiana, united states","6,571",6571
"bayport, new york, united states","6,570",6570
"cheswick, pennsylvania, united states","6,568",6568
"kāngra, himachal pradesh, india","6,568",6568
"neptune beach, florida, united states","6,568",6568
"burgaw, north carolina, united states","6,567",6567
"spring hill, kansas, united states","6,566",6566
"waimanalo, hawaii, united states","6,566",6566
"duval, florida, united states","6,564",6564
"breckenridge, texas, united states","6,563",6563
"fairview, pennsylvania, united states","6,563",6563
"irvington, new york, united states","6,561",6561
"linton, indiana, united states","6,559",6559
"mansfield, louisiana, united states","6,557",6557
"port saint joe, florida, united states","6,557",6557
"walker, georgia, united states","6,556",6556
"monticello, georgia, united states","6,551",6551
"stratford, ontario, canada","6,551",6551
"cagliari, sardinia, italy","6,544",6544
"denton, maryland, united states","6,544",6544
"chelsea, alabama, united states","6,543",6543
"larkspur, california, united states","6,543",6543
"ashqelon, hadarom, israel","6,538",6538
"palmyra, new york, united states","6,538",6538
"fairdale, kentucky, united states","6,537",6537
"pine grove, pennsylvania, united states","6,536",6536
"stanhope, new jersey, united states","6,535",6535
"anaconda, montana, united states","6,534",6534
"xanxere, santa catarina, brazil","6,534",6534
"gretna, nebraska, united states","6,533",6533
"carazinho, rio grande do sul, brazil","6,531",6531
"swindon, swindon, united kingdom","6,531",6531
"marau, rio grande do sul, brazil","6,527",6527
"rodeo, california, united states","6,527",6527
"ripon, wisconsin, united states","6,525",6525
"kaliningrad, kaliningrad, russia","6,524",6524
"park ridge, new jersey, united states","6,524",6524
"jasper, tennessee, united states","6,523",6523
"erlangen, bavaria, germany","6,522",6522
"leola, pennsylvania, united states","6,522",6522
"marksville, louisiana, united states","6,522",6522
"wright city, missouri, united states","6,520",6520
"corcoran, california, united states","6,516",6516
"deer park, washington, united states","6,516",6516
"mendham, new jersey, united states","6,516",6516
"genesee, michigan, united states","6,515",6515
"townsend, delaware, united states","6,515",6515
"greene, new york, united states","6,514",6514
"del valle, texas, united states","6,504",6504
"warsaw, missouri, united states","6,496",6496
"brooklyn center, minnesota, united states","6,495",6495
"fortville, indiana, united states","6,495",6495
"leduc, alberta, canada","6,495",6495
"new market, alabama, united states","6,495",6495
"hamilton, alabama, united states","6,492",6492
"hollister, missouri, united states","6,491",6491
"livingston, tennessee, united states","6,491",6491
"middlebury, connecticut, united states","6,491",6491
"white, georgia, united states","6,486",6486
"booneville, arkansas, united states","6,485",6485
"vryheid, kwazulu-natal, south africa","6,484",6484
"east troy, wisconsin, united states","6,482",6482
"springfield, vermont, united states","6,482",6482
"la follette, tennessee, united states","6,480",6480
"miri, sarawak, malaysia","6,479",6479
"daleville, alabama, united states","6,476",6476
"sheboygan falls, wisconsin, united states","6,476",6476
"cloverdale, california, united states","6,474",6474
"webster, florida, united states","6,473",6473
"cranberry township, pennsylvania, united states","6,471",6471
"valley city, north dakota, united states","6,470",6470
"sulphur, oklahoma, united states","6,469",6469
"rugby, warwickshire, united kingdom","6,465",6465
"mount carmel, illinois, united states","6,464",6464
"wimauma, florida, united states","6,464",6464
"bladensburg, maryland, united states","6,461",6461
"milan, michigan, united states","6,461",6461
"mount horeb, wisconsin, united states","6,459",6459
"huntsville, arkansas, united states","6,457",6457
"dardanelle, arkansas, united states","6,456",6456
"anna, texas, united states","6,454",6454
"wernersville, pennsylvania, united states","6,454",6454
"vandergrift, pennsylvania, united states","6,453",6453
"alma, georgia, united states","6,452",6452
"duncannon, pennsylvania, united states","6,450",6450
"freedom, pennsylvania, united states","6,450",6450
"potosi, missouri, united states","6,449",6449
"poteau, oklahoma, united states","6,448",6448
"holley, new york, united states","6,447",6447
"lexington, nebraska, united states","6,447",6447
"dodgeville, wisconsin, united states","6,443",6443
"tylertown, mississippi, united states","6,443",6443
"rhinebeck, new york, united states","6,440",6440
"shavertown, pennsylvania, united states","6,437",6437
"terryville, connecticut, united states","6,434",6434
"folsom, pennsylvania, united states","6,431",6431
"western springs, illinois, united states","6,430",6430
"farmville, north carolina, united states","6,429",6429
"joshua tree, california, united states","6,429",6429
"topsham, maine, united states","6,429",6429
"farmington, arkansas, united states","6,428",6428
"guadalupe, texas, united states","6,425",6425
"portland, michigan, united states","6,425",6425
"wiesbaden, hesse, germany","6,425",6425
"jaunpur, uttar pradesh, india","6,424",6424
"pecos, texas, united states","6,424",6424
"moyock, north carolina, united states","6,417",6417
"ketchikan, alaska, united states","6,416",6416
"charlestown, rhode island, united states","6,413",6413
"sound beach, new york, united states","6,412",6412
"whitehall, michigan, united states","6,411",6411
"ayden, north carolina, united states","6,410",6410
"ballston lake, new york, united states","6,410",6410
"strasburg, virginia, united states","6,408",6408
"avare, sao paulo, brazil","6,407",6407
"waverly, new york, united states","6,406",6406
"clinton, ohio, united states","6,403",6403
"dartmouth, massachusetts, united states","6,402",6402
"diamondhead, mississippi, united states","6,401",6401
"owings, maryland, united states","6,401",6401
"linthicum heights, maryland, united states","6,398",6398
"fort benning, georgia, united states","6,397",6397
"whitehorse, yukon, canada","6,397",6397
"metamora, illinois, united states","6,392",6392
"beach park, illinois, united states","6,388",6388
"englewood cliffs, new jersey, united states","6,386",6386
"houston, georgia, united states","6,380",6380
"minerva, ohio, united states","6,378",6378
"flatwoods, kentucky, united states","6,375",6375
"harlan, kentucky, united states","6,374",6374
"thomaston, connecticut, united states","6,373",6373
"veenendaal, utrecht, netherlands","6,373",6373
"montrose, pennsylvania, united states","6,370",6370
"waterford, pennsylvania, united states","6,365",6365
"oakwood, georgia, united states","6,364",6364
"wilmer, alabama, united states","6,364",6364
"gafsa governorate, gafsa, tunisia","6,362",6362
"coventry, connecticut, united states","6,361",6361
"jackson, wisconsin, united states","6,359",6359
"le roy, new york, united states","6,358",6358
"luray, virginia, united states","6,358",6358
"winterset, iowa, united states","6,356",6356
"wageningen, gelderland, netherlands","6,355",6355
"camden, georgia, united states","6,353",6353
"wiggins, mississippi, united states","6,351",6351
"libby, montana, united states","6,350",6350
"wellesley hills, massachusetts, united states","6,345",6345
"berryville, arkansas, united states","6,343",6343
"mendenhall, mississippi, united states","6,340",6340
"erzurum, erzurum, turkey","6,336",6336
"smithfield, utah, united states","6,334",6334
"oradell, new jersey, united states","6,329",6329
"seward, nebraska, united states","6,329",6329
"berkeley springs, west virginia, united states","6,328",6328
"borlange, dalarnas lan, sweden","6,328",6328
"clinton, illinois, united states","6,327",6327
"philipsburg, pennsylvania, united states","6,326",6326
"huntingburg, indiana, united states","6,324",6324
"de queen, arkansas, united states","6,322",6322
"white river junction, vermont, united states","6,320",6320
"aberdeen, mississippi, united states","6,316",6316
"douglas, wyoming, united states","6,314",6314
"ripley, west virginia, united states","6,314",6314
"oro valley, arizona, united states","6,313",6313
"cottonwood, california, united states","6,312",6312
"spring branch, texas, united states","6,311",6311
"perry, oklahoma, united states","6,307",6307
"muldrow, oklahoma, united states","6,305",6305
"carlinville, illinois, united states","6,303",6303
"closter, new jersey, united states","6,303",6303
"mifflinburg, pennsylvania, united states","6,303",6303
"dumas, arkansas, united states","6,302",6302
"grants, new mexico, united states","6,302",6302
"logan, west virginia, united states","6,302",6302
"boulder creek, california, united states","6,301",6301
"red hook, new york, united states","6,301",6301
"spirit lake, iowa, united states","6,300",6300
"wayne, west virginia, united states","6,299",6299
"beaverton, michigan, united states","6,298",6298
"staunton, illinois, united states","6,297",6297
"evansville, wisconsin, united states","6,295",6295
"honeoye falls, new york, united states","6,293",6293
"rocky point, north carolina, united states","6,293",6293
"socorro, new mexico, united states","6,290",6290
"jessup, maryland, united states","6,289",6289
"quarryville, pennsylvania, united states","6,289",6289
"jackson, california, united states","6,288",6288
"leonia, new jersey, united states","6,287",6287
"soldotna, alaska, united states","6,285",6285
"gilbert, south carolina, united states","6,284",6284
"gray court, south carolina, united states","6,283",6283
"kenly, north carolina, united states","6,282",6282
"demopolis, alabama, united states","6,280",6280
"north manchester, indiana, united states","6,280",6280
"linwood, new jersey, united states","6,277",6277
"hailey, idaho, united states","6,275",6275
"devon, pennsylvania, united states","6,272",6272
"bloomfield, indiana, united states","6,266",6266
"kitty hawk, north carolina, united states","6,265",6265
"georgetown, ohio, united states","6,259",6259
"west liberty, kentucky, united states","6,259",6259
"swannanoa, north carolina, united states","6,256",6256
"jacksboro, tennessee, united states","6,254",6254
"sutherlin, oregon, united states","6,253",6253
"bissau, bissau, guinea-bissau","6,252",6252
"oakland, tennessee, united states","6,252",6252
"walnut cove, north carolina, united states","6,252",6252
"lawrenceville, new jersey, united states","6,250",6250
"putnam valley, new york, united states","6,250",6250
"coopersville, michigan, united states","6,244",6244
"ituiutaba, minas gerais, brazil","6,243",6243
"ponte nova, minas gerais, brazil","6,243",6243
"brisbane, california, united states","6,241",6241
"floyds knobs, indiana, united states","6,241",6241
"grandview, washington, united states","6,240",6240
"gridley, california, united states","6,237",6237
"ava, missouri, united states","6,236",6236
"hamburg, new jersey, united states","6,234",6234
"bogota, new jersey, united states","6,229",6229
"stewartstown, pennsylvania, united states","6,227",6227
"hales corners, wisconsin, united states","6,226",6226
"big stone gap, virginia, united states","6,225",6225
"whitwell, tennessee, united states","6,225",6225
"brush prairie, washington, united states","6,224",6224
"fairfax, california, united states","6,224",6224
"sidney, nebraska, united states","6,224",6224
"caribou, maine, united states","6,221",6221
"creswell, oregon, united states","6,219",6219
"fremont, indiana, united states","6,217",6217
"south yarmouth, massachusetts, united states","6,217",6217
"salyersville, kentucky, united states","6,214",6214
"bunnell, florida, united states","6,213",6213
"williamsport, maryland, united states","6,212",6212
"chesapeake beach, maryland, united states","6,208",6208
"portsmouth, portsmouth, united kingdom","6,208",6208
"andover, new jersey, united states","6,206",6206
"chinle, arizona, united states","6,206",6206
"trinity, texas, united states","6,206",6206
"woodville, texas, united states","6,205",6205
"saddle river, new jersey, united states","6,203",6203
"franklinville, new jersey, united states","6,201",6201
"elma, washington, united states","6,200",6200
"patterson, louisiana, united states","6,197",6197
"itapeva, sao paulo, brazil","6,196",6196
"mattawan, michigan, united states","6,195",6195
"osmanabad, maharashtra, india","6,195",6195
"acushnet, massachusetts, united states","6,194",6194
"zelienople, pennsylvania, united states","6,194",6194
"galena, ohio, united states","6,193",6193
"kingfisher, oklahoma, united states","6,193",6193
"williamson, texas, united states","6,193",6193
"whippany, new jersey, united states","6,191",6191
"middelburg, mpumalanga, south africa","6,188",6188
"varna, varna, bulgaria","6,188",6188
"doylestown, ohio, united states","6,186",6186
"clyde, north carolina, united states","6,184",6184
"lumberton, new jersey, united states","6,183",6183
"maxton, north carolina, united states","6,181",6181
"bridgeport, texas, united states","6,179",6179
"centreville, maryland, united states","6,177",6177
"milton, west virginia, united states","6,177",6177
"balch springs, texas, united states","6,176",6176
"elkin, north carolina, united states","6,175",6175
"benton city, washington, united states","6,174",6174
"east greenbush, new york, united states","6,173",6173
"independence, iowa, united states","6,171",6171
"saranac lake, new york, united states","6,166",6166
"seri kembangan, selangor, malaysia","6,164",6164
"adamsville, alabama, united states","6,163",6163
"trafford, pennsylvania, united states","6,163",6163
"waterville, ohio, united states","6,155",6155
"williamstown, massachusetts, united states","6,154",6154
"marshville, north carolina, united states","6,153",6153
"rural hall, north carolina, united states","6,153",6153
"bom despacho, minas gerais, brazil","6,149",6149
"triangle, virginia, united states","6,148",6148
"williamsburg, ohio, united states","6,148",6148
"blakely, georgia, united states","6,147",6147
"prairie du chien, wisconsin, united states","6,146",6146
"central square, new york, united states","6,145",6145
"temple terrace, florida, united states","6,145",6145
"willows, california, united states","6,145",6145
"hilliard, florida, united states","6,144",6144
"norridge, illinois, united states","6,141",6141
"eatonville, washington, united states","6,140",6140
"winnemucca, nevada, united states","6,140",6140
"ada, ohio, united states","6,139",6139
"rockaway park, new york, united states","6,137",6137
"drummondville, quebec, canada","6,136",6136
"jataí, goias, brazil","6,136",6136
"hallsville, texas, united states","6,135",6135
"point pleasant, west virginia, united states","6,134",6134
"cottage grove, wisconsin, united states","6,132",6132
"tinton falls, new jersey, united states","6,130",6130
"king city, california, united states","6,128",6128
"lambertville, new jersey, united states","6,128",6128
"southwick, massachusetts, united states","6,127",6127
"gladstone, missouri, united states","6,126",6126
"west terre haute, indiana, united states","6,126",6126
"kenai, alaska, united states","6,125",6125
"old town, maine, united states","6,124",6124
"coal city, illinois, united states","6,122",6122
"gatlinburg, tennessee, united states","6,120",6120
"wynnewood, pennsylvania, united states","6,120",6120
"pahoa, hawaii, united states","6,119",6119
"bilāspur, chhattisgarh, india","6,118",6118
"huntingdon, tennessee, united states","6,117",6117
"mount rainier, maryland, united states","6,113",6113
"quirinópolis, goias, brazil","6,111",6111
"caruthersville, missouri, united states","6,110",6110
"mantua, ohio, united states","6,110",6110
"inwood, west virginia, united states","6,108",6108
"page, arizona, united states","6,107",6107
"folcroft, pennsylvania, united states","6,106",6106
"summit, mississippi, united states","6,105",6105
"ulysses, kansas, united states","6,104",6104
"raymond, mississippi, united states","6,103",6103
"coldwater, mississippi, united states","6,101",6101
"ornskoldsvik, vasternorrlands lan, sweden","6,097",6097
"pali, rajasthan, india","6,097",6097
"palmer, massachusetts, united states","6,097",6097
"laughlin, nevada, united states","6,096",6096
"seminole, texas, united states","6,096",6096
"madison, illinois, united states","6,092",6092
"timmins, ontario, canada","6,092",6092
"deoria, uttar pradesh, india","6,090",6090
"ludowici, georgia, united states","6,089",6089
"tremonton, utah, united states","6,089",6089
"glenwood, iowa, united states","6,087",6087
"tlaquepaque, jalisco, mexico","6,087",6087
"chepachet, rhode island, united states","6,086",6086
"delphi, indiana, united states","6,086",6086
"saint charles, louisiana, united states","6,086",6086
"glendale, new york, united states","6,085",6085
"santa helena de goias, goias, brazil","6,081",6081
"payette, idaho, united states","6,080",6080
"sharpsville, pennsylvania, united states","6,080",6080
"miramar beach, florida, united states","6,079",6079
"milltown, new jersey, united states","6,078",6078
"quantico, virginia, united states","6,075",6075
"washingtonville, new york, united states","6,073",6073
"belfast, maine, united states","6,071",6071
"maplewood, minnesota, united states","6,069",6069
"wenonah, new jersey, united states","6,069",6069
"worland, wyoming, united states","6,069",6069
"trenton, tennessee, united states","6,068",6068
"greenfield, ohio, united states","6,067",6067
"sivas, sivas, turkey","6,067",6067
"churu, rajasthan, india","6,065",6065
"jaguariúna, sao paulo, brazil","6,062",6062
"potgietersrus, limpopo, south africa","6,060",6060
"chester, new jersey, united states","6,057",6057
"dawson, georgia, united states","6,056",6056
"norfolk, norfolk, united kingdom","6,056",6056
"prince albert, saskatchewan, canada","6,055",6055
"lamar, missouri, united states","6,054",6054
"lebanon, new jersey, united states","6,054",6054
"plaistow, new hampshire, united states","6,054",6054
"devine, texas, united states","6,053",6053
"washington, georgia, united states","6,052",6052
"hunt valley, maryland, united states","6,050",6050
"freeport, maine, united states","6,049",6049
"fredericktown, ohio, united states","6,048",6048
"skaneateles, new york, united states","6,048",6048
"florence, massachusetts, united states","6,047",6047
"whitmore lake, michigan, united states","6,045",6045
"dublin, virginia, united states","6,042",6042
"livingston, california, united states","6,041",6041
"hanumangarh, rajasthan, india","6,040",6040
"são borja, rio grande do sul, brazil","6,038",6038
"ayer, massachusetts, united states","6,029",6029
"wells, maine, united states","6,028",6028
"saint james, missouri, united states","6,027",6027
"corryton, tennessee, united states","6,026",6026
"greenville, rhode island, united states","6,026",6026
"kyoto, kyoto, japan","6,026",6026
"mountain grove, missouri, united states","6,026",6026
"springfield, georgia, united states","6,024",6024
"telêmaco borba, parana, brazil","6,024",6024
"alpine, texas, united states","6,023",6023
"bowmanville, ontario, canada","6,023",6023
"selmer, tennessee, united states","6,023",6023
"reeds spring, missouri, united states","6,022",6022
"medford, wisconsin, united states","6,019",6019
"springville, new york, united states","6,017",6017
"easton, connecticut, united states","6,015",6015
"mirabel, quebec, canada","6,015",6015
"san luis, arizona, united states","6,014",6014
"vilonia, arkansas, united states","6,014",6014
"corona del mar, california, united states","6,012",6012
"snyder, texas, united states","6,012",6012
"pacific, washington, united states","6,008",6008
"shropshire, shropshire, united kingdom","6,008",6008
"lighthouse point, florida, united states","6,007",6007
"averill park, new york, united states","6,005",6005
"terry, mississippi, united states","6,004",6004
"mission, british columbia, canada","6,003",6003
"bolton, ontario, canada","6,000",6000
