Value,Count,Numeric
"grand haven, michigan, united states","26,567",26567
"hereford, herefordshire, united kingdom","26,566",26566
"menifee, california, united states","26,565",26565
"thibodaux, louisiana, united states","26,546",26546
"richmond hill, new york, united states","26,542",26542
"sedalia, missouri, united states","26,542",26542
"avellino, campania, italy","26,529",26529
"villa park, illinois, united states","26,525",26525
"lockport, illinois, united states","26,497",26497
"auburndale, florida, united states","26,495",26495
"pittsburg, kansas, united states","26,477",26477
"kurnool, andhra pradesh, india","26,475",26475
"moorpark, california, united states","26,471",26471
"raeford, north carolina, united states","26,467",26467
"la quinta, california, united states","26,461",26461
"caceres, extremadura, spain","26,447",26447
"el dorado hills, california, united states","26,436",26436
"sherwood, arkansas, united states","26,404",26404
"beachwood, ohio, united states","26,403",26403
"marshall, texas, united states","26,397",26397
"warrensburg, missouri, united states","26,381",26381
"panama city beach, florida, united states","26,364",26364
"lexington park, maryland, united states","26,361",26361
"calabasas, california, united states","26,358",26358
"park city, utah, united states","26,346",26346
"juazeiro do norte, ceará, brazil","26,333",26333
"riverton, utah, united states","26,333",26333
"satara, maharashtra, india","26,326",26326
"rego park, new york, united states","26,309",26309
"fenton, michigan, united states","26,306",26306
"ceres, california, united states","26,287",26287
"mundelein, illinois, united states","26,254",26254
"fremont, nebraska, united states","26,222",26222
"sonoma, california, united states","26,187",26187
"post falls, idaho, united states","26,185",26185
"marshalltown, iowa, united states","26,158",26158
"clarksburg, west virginia, united states","26,146",26146
"severn, maryland, united states","26,132",26132
"livingston, louisiana, united states","26,130",26130
"quakertown, pennsylvania, united states","26,129",26129
"darby, pennsylvania, united states","26,097",26097
"del rio, texas, united states","26,082",26082
"grayslake, illinois, united states","26,055",26055
"georgetown, south carolina, united states","26,049",26049
"reseda, california, united states","26,036",26036
"asbury park, new jersey, united states","26,018",26018
"pittsford, new york, united states","26,014",26014
"mandeville, louisiana, united states","26,010",26010
"san jacinto, california, united states","25,966",25966
"montgomery village, maryland, united states","25,949",25949
"saint johns, florida, united states","25,939",25939
"sylacauga, alabama, united states","25,935",25935
"batavia, ohio, united states","25,927",25927
"deerfield, illinois, united states","25,921",25921
"romulus, michigan, united states","25,916",25916
"marysville, california, united states","25,908",25908
"meadville, pennsylvania, united states","25,897",25897
"suzhou, jiangsu, china","25,897",25897
"sharon, pennsylvania, united states","25,880",25880
"butte, montana, united states","25,873",25873
"davison, michigan, united states","25,872",25872
"michigan city, indiana, united states","25,851",25851
"lebanon, ohio, united states","25,836",25836
"middle river, maryland, united states","25,824",25824
"franklin, indiana, united states","25,800",25800
"paramus, new jersey, united states","25,798",25798
"deer park, new york, united states","25,780",25780
"douglas, georgia, united states","25,765",25765
"brunswick, niedersachsen, germany","25,758",25758
"burlington, iowa, united states","25,756",25756
"moscow, idaho, united states","25,735",25735
"oak park, michigan, united states","25,734",25734
"nanjing, jiangsu, china","25,733",25733
"oxon hill, maryland, united states","25,717",25717
"american fork, utah, united states","25,689",25689
"nuevo laredo, tamaulipas, mexico","25,670",25670
"reidsville, north carolina, united states","25,654",25654
"prato, tuscany, italy","25,643",25643
"defiance, ohio, united states","25,638",25638
"ponte vedra beach, florida, united states","25,591",25591
"branson, missouri, united states","25,584",25584
"san juan capistrano, california, united states","25,559",25559
"newton, massachusetts, united states","25,508",25508
"shah alam, selangor, malaysia","25,504",25504
"strasbourg, alsace, france","25,495",25495
"girona, catalonia, spain","25,476",25476
"cuttack, orissa, india","25,465",25465
"franklin, wisconsin, united states","25,465",25465
"kristiansand, vest-agder, norway","25,412",25412
"sylvania, ohio, united states","25,404",25404
"rockford, michigan, united states","25,396",25396
"duncan, oklahoma, united states","25,394",25394
"marília, sao paulo, brazil","25,376",25376
"sammamish, washington, united states","25,375",25375
"gretna, louisiana, united states","25,372",25372
"mount vernon, ohio, united states","25,369",25369
"reisterstown, maryland, united states","25,367",25367
"la verne, california, united states","25,354",25354
"chelmsford, massachusetts, united states","25,330",25330
"natchez, mississippi, united states","25,328",25328
"lake jackson, texas, united states","25,326",25326
"rancho palos verdes, california, united states","25,314",25314
"hope mills, north carolina, united states","25,285",25285
"lincoln, california, united states","25,278",25278
"west warwick, rhode island, united states","25,252",25252
"junction city, kansas, united states","25,236",25236
"catanduva, sao paulo, brazil","25,227",25227
"marilia, sao paulo, brazil","25,216",25216
"dartmouth, nova scotia, canada","25,205",25205
"the bronx, new york, united states","25,184",25184
"alamogordo, new mexico, united states","25,179",25179
"lorient, bretagne, france","25,177",25177
"seymour, indiana, united states","25,170",25170
"kingsville, texas, united states","25,166",25166
"livingston, texas, united states","25,162",25162
"pistoia, tuscany, italy","25,137",25137
"bloomsburg, pennsylvania, united states","25,128",25128
"norwood, massachusetts, united states","25,111",25111
"new baltimore, michigan, united states","25,103",25103
"catanzaro, calabria, italy","25,099",25099
"natchitoches, louisiana, united states","25,098",25098
"schertz, texas, united states","25,088",25088
"bridgeton, new jersey, united states","25,069",25069
"brindisi, puglia, italy","25,064",25064
"warminster, pennsylvania, united states","25,062",25062
"maywood, illinois, united states","25,056",25056
"palakkad, kerala, india","25,050",25050
"wollongong, new south wales, australia","25,046",25046
"solon, ohio, united states","25,039",25039
"hobart, indiana, united states","25,033",25033
"newtown, pennsylvania, united states","25,028",25028
"ciudad victoria, tamaulipas, mexico","25,004",25004
"melrose park, illinois, united states","25,004",25004
"bedford, virginia, united states","25,001",25001
"wappingers falls, new york, united states","24,999",24999
"erfurt, thuringia, germany","24,997",24997
"addison, texas, united states","24,991",24991
"newburgh, indiana, united states","24,982",24982
"andover, minnesota, united states","24,980",24980
"jamshedpur, jharkhand, india","24,951",24951
"antofagasta, antofagasta, chile","24,944",24944
"lake orion, michigan, united states","24,930",24930
"chevy chase, maryland, united states","24,921",24921
"dickson, tennessee, united states","24,906",24906
"floral park, new york, united states","24,904",24904
"khammam, telangana, india","24,902",24902
"pahrump, nevada, united states","24,896",24896
"homosassa, florida, united states","24,890",24890
"maryland heights, missouri, united states","24,887",24887
"plainview, new york, united states","24,875",24875
"seneca, south carolina, united states","24,866",24866
"essen, north rhine-westphalia, germany","24,853",24853
"benicia, california, united states","24,842",24842
"waxhaw, north carolina, united states","24,831",24831
"kimberley, northern cape, south africa","24,828",24828
"morrow, georgia, united states","24,806",24806
"franklin, massachusetts, united states","24,787",24787
"odenton, maryland, united states","24,727",24727
"san carlos, california, united states","24,724",24724
"holbrook, new york, united states","24,715",24715
"fairburn, georgia, united states","24,688",24688
"coos bay, oregon, united states","24,661",24661
"glassboro, new jersey, united states","24,659",24659
"woodridge, illinois, united states","24,594",24594
"dickinson, texas, united states","24,589",24589
"port chester, new york, united states","24,573",24573
"shelton, washington, united states","24,563",24563
"yokohama, kanagawa, japan","24,556",24556
"riverhead, new york, united states","24,533",24533
"wentzville, missouri, united states","24,529",24529
"langley, british columbia, canada","24,518",24518
"trenton, michigan, united states","24,518",24518
"montrose, colorado, united states","24,502",24502
"ashland, ohio, united states","24,484",24484
"eustis, florida, united states","24,465",24465
"salem, new hampshire, united states","24,449",24449
"harrison, arkansas, united states","24,444",24444
"seoul, seoul-t'ukpyolsi, south korea","24,443",24443
"sherbrooke, quebec, canada","24,440",24440
"sykesville, maryland, united states","24,421",24421
"sewell, new jersey, united states","24,401",24401
"parnamirim, rio grande do norte, brazil","24,390",24390
"woodstock, illinois, united states","24,383",24383
"randallstown, maryland, united states","24,374",24374
"watertown, south dakota, united states","24,368",24368
"pikesville, maryland, united states","24,361",24361
"corsicana, texas, united states","24,335",24335
"nutley, new jersey, united states","24,333",24333
"marietta, ohio, united states","24,330",24330
"várzea grande, mato grosso, brazil","24,320",24320
"palestine, texas, united states","24,319",24319
"cheshire, connecticut, united states","24,316",24316
"viterbo, lazio, italy","24,316",24316
"calais, nord-pas-de-calais, france","24,313",24313
"marysville, ohio, united states","24,308",24308
"potenza, basilicata, italy","24,292",24292
"mataró, catalonia, spain","24,291",24291
"orange, new jersey, united states","24,265",24265
"brownsburg, indiana, united states","24,260",24260
"guaratinguetá, sao paulo, brazil","24,260",24260
"ballston spa, new york, united states","24,253",24253
"bedford, ohio, united states","24,253",24253
"garfield, new jersey, united states","24,223",24223
"trapani, sicily, italy","24,200",24200
"beaver falls, pennsylvania, united states","24,196",24196
"west memphis, arkansas, united states","24,180",24180
"augusta, maine, united states","24,178",24178
"tualatin, oregon, united states","24,167",24167
"coquitlam, british columbia, canada","24,166",24166
"amsterdam, new york, united states","24,162",24162
"selma, alabama, united states","24,154",24154
"boerne, texas, united states","24,152",24152
"alvorada, rio grande do sul, brazil","24,149",24149
"sand springs, oklahoma, united states","24,147",24147
"rahway, new jersey, united states","24,139",24139
"corbin, kentucky, united states","24,136",24136
"springfield gardens, new york, united states","24,133",24133
"itabuna, bahia, brazil","24,121",24121
"sangli, maharashtra, india","24,093",24093
"pittston, pennsylvania, united states","24,086",24086
"itapevi, sao paulo, brazil","24,070",24070
"vincennes, indiana, united states","24,033",24033
"flowery branch, georgia, united states","24,011",24011
"pearl, mississippi, united states","23,995",23995
"buffalo grove, illinois, united states","23,983",23983
"wantagh, new york, united states","23,976",23976
"haltom city, texas, united states","23,962",23962
"allen park, michigan, united states","23,956",23956
"bento gonçalves, rio grande do sul, brazil","23,955",23955
"woodbury, new jersey, united states","23,947",23947
"oconomowoc, wisconsin, united states","23,937",23937
"camaçari, bahia, brazil","23,895",23895
"saratoga, california, united states","23,895",23895
"glasgow, kentucky, united states","23,890",23890
"shakopee, minnesota, united states","23,880",23880
"sikeston, missouri, united states","23,862",23862
"minnetonka, minnesota, united states","23,859",23859
"bethel park, pennsylvania, united states","23,858",23858
"portsmouth, ohio, united states","23,843",23843
"araruama, rio de janeiro, brazil","23,825",23825
"hanover park, illinois, united states","23,825",23825
"carlsbad, new mexico, united states","23,821",23821
"southaven, mississippi, united states","23,813",23813
"ellensburg, washington, united states","23,811",23811
"wethersfield, connecticut, united states","23,804",23804
"harker heights, texas, united states","23,787",23787
"clarkston, michigan, united states","23,786",23786
"redmond, oregon, united states","23,777",23777
"pleasant grove, utah, united states","23,751",23751
"phillipsburg, new jersey, united states","23,736",23736
"port washington, new york, united states","23,733",23733
"big spring, texas, united states","23,732",23732
"monroe, new york, united states","23,732",23732
"los lunas, new mexico, united states","23,729",23729
"flemington, new jersey, united states","23,723",23723
"menomonee falls, wisconsin, united states","23,721",23721
"orchard park, new york, united states","23,719",23719
"mays landing, new jersey, united states","23,711",23711
"long island city, new york, united states","23,709",23709
"westfield, new jersey, united states","23,676",23676
"madisonville, kentucky, united states","23,673",23673
"castaic, california, united states","23,667",23667
"coral gables, florida, united states","23,664",23664
"plainfield, indiana, united states","23,630",23630
"ramona, california, united states","23,627",23627
"angra dos reis, rio de janeiro, brazil","23,626",23626
"baldwinsville, new york, united states","23,586",23586
"rossville, georgia, united states","23,585",23585
"wadsworth, ohio, united states","23,570",23570
"dover, pennsylvania, united states","23,554",23554
"jasper, alabama, united states","23,552",23552
"trevose, pennsylvania, united states","23,552",23552
"laguna beach, california, united states","23,533",23533
"abbotsford, british columbia, canada","23,527",23527
"round lake, illinois, united states","23,525",23525
"silverdale, washington, united states","23,515",23515
"jackson, missouri, united states","23,514",23514
"pearl city, hawaii, united states","23,500",23500
"dyersburg, tennessee, united states","23,476",23476
"randolph, massachusetts, united states","23,476",23476
"belton, missouri, united states","23,474",23474
"ambler, pennsylvania, united states","23,463",23463
"dana point, california, united states","23,431",23431
"mahwah, new jersey, united states","23,408",23408
"perth, perth and kinross, united kingdom","23,394",23394
"johnston, rhode island, united states","23,379",23379
"lansdowne, pennsylvania, united states","23,376",23376
"west chicago, illinois, united states","23,374",23374
"bharūch, gujarat, india","23,366",23366
"woodbridge, new jersey, united states","23,366",23366
"bemidji, minnesota, united states","23,360",23360
"brahmapur, orissa, india","23,357",23357
"oceanside, new york, united states","23,353",23353
"red oak, texas, united states","23,352",23352
"gonzales, louisiana, united states","23,331",23331
"belvidere, illinois, united states","23,328",23328
"daphne, alabama, united states","23,322",23322
"marina del rey, california, united states","23,322",23322
"glenside, pennsylvania, united states","23,314",23314
"avon, indiana, united states","23,312",23312
"beaumont, california, united states","23,307",23307
"shrewsbury, massachusetts, united states","23,301",23301
"piqua, ohio, united states","23,293",23293
"banning, california, united states","23,286",23286
"la vergne, tennessee, united states","23,284",23284
"south windsor, connecticut, united states","23,238",23238
"middleton, wisconsin, united states","23,223",23223
"grovetown, georgia, united states","23,217",23217
"haines city, florida, united states","23,214",23214
"stillwater, minnesota, united states","23,209",23209
"kahului, hawaii, united states","23,202",23202
"latrobe, pennsylvania, united states","23,186",23186
"mackay, queensland, australia","23,152",23152
"adams, colorado, united states","23,151",23151
"north haven, connecticut, united states","23,148",23148
"atascadero, california, united states","23,132",23132
"garden city, kansas, united states","23,113",23113
"south lake tahoe, california, united states","23,112",23112
"whitby, ontario, canada","23,110",23110
"coconut creek, florida, united states","23,106",23106
"whitestone, new york, united states","23,106",23106
"marion, illinois, united states","23,098",23098
"warrenton, virginia, united states","23,098",23098
"henderson, texas, united states","23,081",23081
"arnhem, gelderland, netherlands","23,075",23075
"gloucester, massachusetts, united states","23,061",23061
"carapicuiba, sao paulo, brazil","23,055",23055
"albacete, castille-la mancha, spain","23,053",23053
"pottsville, pennsylvania, united states","23,033",23033
"longueuil, quebec, canada","23,023",23023
"thornhill, ontario, canada","23,013",23013
"calicut, kerala, india","22,982",22982
"north andover, massachusetts, united states","22,981",22981
"millington, tennessee, united states","22,971",22971
"owatonna, minnesota, united states","22,955",22955
"huntington, indiana, united states","22,951",22951
"libertyville, illinois, united states","22,948",22948
"fulton, new york, united states","22,940",22940
"chatsworth, georgia, united states","22,922",22922
"lansing, illinois, united states","22,913",22913
"woodhaven, new york, united states","22,898",22898
"shelbyville, indiana, united states","22,884",22884
"cape may, new jersey, united states","22,880",22880
"osaka, ōsaka, japan","22,874",22874
"queen creek, arizona, united states","22,873",22873
"teramo, abruzzo, italy","22,867",22867
"eagle pass, texas, united states","22,854",22854
"mill valley, california, united states","22,854",22854
"new milford, connecticut, united states","22,848",22848
"hampshire, hampshire, united kingdom","22,839",22839
"francisco beltrão, parana, brazil","22,833",22833
"hyde park, massachusetts, united states","22,823",22823
"oxford, ohio, united states","22,802",22802
"lafayette, colorado, united states","22,787",22787
"moncks corner, south carolina, united states","22,780",22780
"niles, illinois, united states","22,738",22738
"ottumwa, iowa, united states","22,732",22732
"brainerd, minnesota, united states","22,711",22711
"indian trail, north carolina, united states","22,709",22709
"mountain home, arkansas, united states","22,705",22705
"martinsville, indiana, united states","22,699",22699
"danvers, massachusetts, united states","22,691",22691
"coram, new york, united states","22,667",22667
"oakley, california, united states","22,664",22664
"goodlettsville, tennessee, united states","22,643",22643
"canal winchester, ohio, united states","22,628",22628
"bardstown, kentucky, united states","22,621",22621
"eindhoven, north brabant, netherlands","22,619",22619
"north platte, nebraska, united states","22,599",22599
"patos de minas, minas gerais, brazil","22,598",22598
"tewksbury, massachusetts, united states","22,598",22598
"farmington, connecticut, united states","22,580",22580
"elizabethton, tennessee, united states","22,574",22574
"karnāl, haryana, india","22,569",22569
"oakdale, california, united states","22,564",22564
"medford, new york, united states","22,556",22556
"hartsville, south carolina, united states","22,531",22531
"pacoima, california, united states","22,527",22527
"new lenox, illinois, united states","22,507",22507
"savona, liguria, italy","22,504",22504
"kanniyakumari, tamil nadu, india","22,494",22494
"gulbarga, karnataka, india","22,485",22485
"pindamonhangaba, sao paulo, brazil","22,472",22472
"dumfries, virginia, united states","22,469",22469
"paradise, california, united states","22,469",22469
"lake stevens, washington, united states","22,467",22467
"atlantic beach, florida, united states","22,456",22456
"lexington, massachusetts, united states","22,450",22450
"calexico, california, united states","22,446",22446
"conshohocken, pennsylvania, united states","22,439",22439
"reus, catalonia, spain","22,433",22433
"zion, illinois, united states","22,429",22429
"san lorenzo, california, united states","22,425",22425
"grandview, missouri, united states","22,415",22415
"brownwood, texas, united states","22,402",22402
"franklin, virginia, united states","22,396",22396
"oswego, illinois, united states","22,390",22390
"aquila, abruzzi, italy","22,387",22387
"commack, new york, united states","22,387",22387
"uniondale, new york, united states","22,374",22374
"los banos, california, united states","22,364",22364
"granada hills, california, united states","22,360",22360
"vernon hills, illinois, united states","22,355",22355
"ossining, new york, united states","22,353",22353
"midlothian, texas, united states","22,333",22333
"shepherdsville, kentucky, united states","22,322",22322
"frankfort, illinois, united states","22,320",22320
"orebro, orebro lan, sweden","22,319",22319
"shelbyville, tennessee, united states","22,309",22309
"gaziantep, gaziantep, turkey","22,299",22299
"norfolk, nebraska, united states","22,289",22289
"manahawkin, new jersey, united states","22,288",22288
"nixa, missouri, united states","22,284",22284
"chagrin falls, ohio, united states","22,278",22278
"forney, texas, united states","22,267",22267
"oldsmar, florida, united states","22,254",22254
"borås, vaestra goetaland, sweden","22,243",22243
"keene, new hampshire, united states","22,243",22243
"oxford, mississippi, united states","22,242",22242
"bastrop, texas, united states","22,238",22238
"orangevale, california, united states","22,230",22230
"newbury park, california, united states","22,224",22224
"sodertalje, stockholms lan, sweden","22,224",22224
"hudsonville, michigan, united states","22,216",22216
"amityville, new york, united states","22,212",22212
"bell, california, united states","22,196",22196
"cockeysville, maryland, united states","22,177",22177
"hudson, ohio, united states","22,165",22165
"syosset, new york, united states","22,161",22161
"palatka, florida, united states","22,156",22156
"morris, new jersey, united states","22,154",22154
"little elm, texas, united states","22,152",22152
"bartow, florida, united states","22,151",22151
"bellmore, new york, united states","22,143",22143
"culpeper, virginia, united states","22,113",22113
"north highlands, california, united states","22,109",22109
"desert hot springs, california, united states","22,105",22105
"radcliff, kentucky, united states","22,101",22101
"algonquin, illinois, united states","22,093",22093
"superior, wisconsin, united states","22,054",22054
"elizabethtown, pennsylvania, united states","22,041",22041
"lebanon, missouri, united states","22,041",22041
"taichung city, taiwan, taiwan","22,022",22022
"holly springs, north carolina, united states","22,020",22020
"dracut, massachusetts, united states","22,017",22017
"dupage, illinois, united states","22,016",22016
"depew, new york, united states","22,012",22012
"edgewater, florida, united states","22,003",22003
"sussex, new jersey, united states","21,973",21973
"edgewood, maryland, united states","21,972",21972
"milford, massachusetts, united states","21,972",21972
"southgate, michigan, united states","21,943",21943
"tahlequah, oklahoma, united states","21,939",21939
"illes balears, balearic islands, spain","21,925",21925
"cottage grove, minnesota, united states","21,893",21893
"chelsea, massachusetts, united states","21,891",21891
"ephrata, pennsylvania, united states","21,868",21868
"battle ground, washington, united states","21,861",21861
"alabaster, alabama, united states","21,858",21858
"clemmons, north carolina, united states","21,845",21845
"ukiah, california, united states","21,844",21844
"atwater, california, united states","21,842",21842
"crawfordsville, indiana, united states","21,829",21829
"red bank, new jersey, united states","21,825",21825
"hays, kansas, united states","21,822",21822
"elk river, minnesota, united states","21,812",21812
"glen cove, new york, united states","21,806",21806
"roslindale, massachusetts, united states","21,798",21798
"chengdu, sichuan, china","21,793",21793
"new castle, indiana, united states","21,787",21787
"st. gallen, saint gallen, switzerland","21,782",21782
"harvey, louisiana, united states","21,772",21772
"geneva, illinois, united states","21,763",21763
"rapides, louisiana, united states","21,755",21755
"waynesboro, virginia, united states","21,748",21748
"lapeer, michigan, united states","21,745",21745
"havelock, north carolina, united states","21,733",21733
"southlake, texas, united states","21,733",21733
"englewood, new jersey, united states","21,732",21732
"albi, occitanie, france","21,729",21729
"cranford, new jersey, united states","21,724",21724
"ambala, haryana, india","21,714",21714
"olive branch, mississippi, united states","21,706",21706
"talladega, alabama, united states","21,705",21705
"lake forest, illinois, united states","21,689",21689
"newport, kentucky, united states","21,679",21679
"vidor, texas, united states","21,679",21679
"bedford, indiana, united states","21,663",21663
"glendale heights, illinois, united states","21,658",21658
"north royalton, ohio, united states","21,647",21647
"rio das ostras, rio de janeiro, brazil","21,644",21644
"roselle, illinois, united states","21,628",21628
"clarks summit, pennsylvania, united states","21,624",21624
