Value,Count,Numeric
"mohave, arizona, united states","11,298",11298
"berwyn, pennsylvania, united states","11,293",11293
"jennings, louisiana, united states","11,290",11290
"hebron, kentucky, united states","11,279",11279
"hazard, kentucky, united states","11,275",11275
"brewton, alabama, united states","11,272",11272
"newhall, california, united states","11,271",11271
"harrisonville, missouri, united states","11,269",11269
"toledo, parana, brazil","11,266",11266
"hewitt, texas, united states","11,265",11265
"belding, michigan, united states","11,263",11263
"sellersburg, indiana, united states","11,261",11261
"scottsburg, indiana, united states","11,259",11259
"jaú, sao paulo, brazil","11,257",11257
"quinlan, texas, united states","11,257",11257
"tetouan, tanger-tetouan-al hoceima, morocco","11,257",11257
"haledon, new jersey, united states","11,253",11253
"murphy, north carolina, united states","11,249",11249
"clinton, connecticut, united states","11,246",11246
"lowell, arkansas, united states","11,246",11246
"cayce, south carolina, united states","11,239",11239
"alexandria, kentucky, united states","11,238",11238
"roselle park, new jersey, united states","11,235",11235
"waynesburg, pennsylvania, united states","11,235",11235
"port coquitlam, british columbia, canada","11,233",11233
"excelsior, minnesota, united states","11,232",11232
"ottawa, illinois, united states","11,230",11230
"merrill, wisconsin, united states","11,229",11229
"bathinda, punjab, india","11,226",11226
"pawleys island, south carolina, united states","11,223",11223
"marion, south carolina, united states","11,222",11222
"makawao, hawaii, united states","11,214",11214
"port townsend, washington, united states","11,204",11204
"tatum, texas, united states","11,204",11204
"hyde park, new york, united states","11,202",11202
"windham, new hampshire, united states","11,201",11201
"baker, louisiana, united states","11,197",11197
"camillus, new york, united states","11,197",11197
"sobradinho, distrito federal, brazil","11,197",11197
"kenton, ohio, united states","11,196",11196
"cromwell, connecticut, united states","11,182",11182
"fresno, texas, united states","11,176",11176
"columbia, georgia, united states","11,171",11171
"belgrade, montana, united states","11,169",11169
"oskaloosa, iowa, united states","11,167",11167
"silver city, new mexico, united states","11,167",11167
"moundsville, west virginia, united states","11,166",11166
"cape may court house, new jersey, united states","11,159",11159
"foothill ranch, california, united states","11,157",11157
"nevada, missouri, united states","11,157",11157
"saint james, new york, united states","11,157",11157
"lavras, minas gerais, brazil","11,156",11156
"lake geneva, wisconsin, united states","11,150",11150
"jerome, idaho, united states","11,146",11146
"manhattan, new york, united states","11,146",11146
"grain valley, missouri, united states","11,142",11142
"norwich, new york, united states","11,134",11134
"big lake, minnesota, united states","11,133",11133
"gorham, maine, united states","11,132",11132
"alamo, california, united states","11,131",11131
"pontotoc, mississippi, united states","11,131",11131
"hampton bays, new york, united states","11,130",11130
"keizer, oregon, united states","11,129",11129
"merchantville, new jersey, united states","11,124",11124
"ganganagar, rajasthan, india","11,123",11123
"waunakee, wisconsin, united states","11,123",11123
"jasper, texas, united states","11,122",11122
"manasquan, new jersey, united states","11,122",11122
"fishkill, new york, united states","11,121",11121
"chanute, kansas, united states","11,120",11120
"hooksett, new hampshire, united states","11,108",11108
"schofield, wisconsin, united states","11,102",11102
"harnett, north carolina, united states","11,101",11101
"orrville, ohio, united states","11,101",11101
"stephens city, virginia, united states","11,095",11095
"chatham, new jersey, united states","11,094",11094
"santarem, para, brazil","11,093",11093
"kenton, kentucky, united states","11,088",11088
"samara, samara, russia","11,088",11088
"la palma, california, united states","11,086",11086
"skagit, washington, united states","11,085",11085
"tyrone, pennsylvania, united states","11,084",11084
"araguari, minas gerais, brazil","11,082",11082
"callahan, florida, united states","11,078",11078
"ningbo, zhejiang, china","11,072",11072
"middleboro, massachusetts, united states","11,071",11071
"great falls, virginia, united states","11,069",11069
"shawano, wisconsin, united states","11,064",11064
"georgetown, delaware, united states","11,055",11055
"china grove, north carolina, united states","11,053",11053
"waynesboro, georgia, united states","11,042",11042
"clinton, south carolina, united states","11,028",11028
"central falls, rhode island, united states","11,023",11023
"lebanon, new hampshire, united states","11,018",11018
"decatur, texas, united states","11,017",11017
"short hills, new jersey, united states","11,015",11015
"valley center, california, united states","11,013",11013
"pacific, missouri, united states","11,011",11011
"derby, connecticut, united states","11,010",11010
"avignon, provence-alpes-cote d'azur, france","11,007",11007
"heber city, utah, united states","11,003",11003
"warrington, pennsylvania, united states","11,003",11003
"tumkur, karnataka, india","10,998",10998
"fort washington, pennsylvania, united states","10,997",10997
"burlington, washington, united states","10,991",10991
"cutler bay, florida, united states","10,990",10990
"murrysville, pennsylvania, united states","10,987",10987
"dandridge, tennessee, united states","10,985",10985
"charlestown, indiana, united states","10,983",10983
"port jervis, new york, united states","10,983",10983
"scottsville, kentucky, united states","10,976",10976
"hernando, mississippi, united states","10,971",10971
"north salt lake, utah, united states","10,970",10970
"harrisburg, north carolina, united states","10,967",10967
"middlesboro, kentucky, united states","10,954",10954
"pembroke, massachusetts, united states","10,952",10952
"rieti, latium, italy","10,949",10949
"oakton, virginia, united states","10,943",10943
"rostov-na-donu, rostov, russia","10,943",10943
"lihue, hawaii, united states","10,942",10942
"ādilābād, telangana, india","10,934",10934
"dumas, texas, united states","10,931",10931
"hornell, new york, united states","10,930",10930
"wauseon, ohio, united states","10,930",10930
"aurora, ontario, canada","10,916",10916
"pennington, new jersey, united states","10,913",10913
"groveport, ohio, united states","10,898",10898
"nashville, north carolina, united states","10,897",10897
"lasalle, quebec, canada","10,894",10894
"montgomery, new york, united states","10,889",10889
"marica, rio de janeiro, brazil","10,881",10881
"carthage, texas, united states","10,877",10877
"cobb, georgia, united states","10,877",10877
"detroit lakes, minnesota, united states","10,877",10877
"herrin, illinois, united states","10,874",10874
"booneville, mississippi, united states","10,873",10873
"blacklick, ohio, united states","10,865",10865
"douglassville, pennsylvania, united states","10,865",10865
"horry, south carolina, united states","10,863",10863
"fort madison, iowa, united states","10,859",10859
"portage, wisconsin, united states","10,855",10855
"youngsville, north carolina, united states","10,852",10852
"sao sebastiao, sao paulo, brazil","10,850",10850
"baxley, georgia, united states","10,845",10845
"des moines, washington, united states","10,845",10845
"glenshaw, pennsylvania, united states","10,841",10841
"olomouc, olomoucky kraj, czechia","10,841",10841
"sabara, minas gerais, brazil","10,839",10839
"east longmeadow, massachusetts, united states","10,835",10835
"newtown square, pennsylvania, united states","10,832",10832
"gallipolis, ohio, united states","10,829",10829
"cambridge, minnesota, united states","10,825",10825
"plaquemine, louisiana, united states","10,821",10821
"wayzata, minnesota, united states","10,818",10818
"candler, north carolina, united states","10,817",10817
"mandi, himachal pradesh, india","10,811",10811
"jequié, bahia, brazil","10,804",10804
"phuthaditjhaba, free state, south africa","10,804",10804
"laurel, delaware, united states","10,795",10795
"johnson, kansas, united states","10,791",10791
"gloucester, ontario, canada","10,788",10788
"ventnor city, new jersey, united states","10,788",10788
"west point, mississippi, united states","10,786",10786
"clarksville, arkansas, united states","10,784",10784
"fort scott, kansas, united states","10,784",10784
"verdun, quebec, canada","10,784",10784
"saint landry, louisiana, united states","10,782",10782
"richton park, illinois, united states","10,777",10777
"swainsboro, georgia, united states","10,777",10777
"wynne, arkansas, united states","10,775",10775
"glen carbon, illinois, united states","10,769",10769
"hoschton, georgia, united states","10,767",10767
"houghton, michigan, united states","10,761",10761
"landskrona, skåne, sweden","10,761",10761
"grayson, kentucky, united states","10,754",10754
"molalla, oregon, united states","10,742",10742
"minden, louisiana, united states","10,741",10741
"ridgefield, washington, united states","10,740",10740
"augusta, kansas, united states","10,737",10737
"madison heights, virginia, united states","10,735",10735
"mesquite, nevada, united states","10,730",10730
"rajamahendri, andhra pradesh, india","10,730",10730
"oxford, pennsylvania, united states","10,728",10728
"shelby, ohio, united states","10,728",10728
"plainwell, michigan, united states","10,726",10726
"campo limpo paulista, sao paulo, brazil","10,721",10721
"mastic beach, new york, united states","10,715",10715
"tenafly, new jersey, united states","10,715",10715
"wardha, maharashtra, india","10,713",10713
"jewett city, connecticut, united states","10,709",10709
"price, utah, united states","10,703",10703
"haysville, kansas, united states","10,702",10702
"mohali, punjab, india","10,702",10702
"fleming island, florida, united states","10,701",10701
"rocky mount, virginia, united states","10,696",10696
"troy, illinois, united states","10,696",10696
"highland park, new jersey, united states","10,695",10695
"slippery rock, pennsylvania, united states","10,686",10686
"yazoo city, mississippi, united states","10,683",10683
"salto, sao paulo, brazil","10,682",10682
"the woodlands, texas, united states","10,681",10681
"montevallo, alabama, united states","10,680",10680
"half moon bay, california, united states","10,671",10671
"castanhal, para, brazil","10,670",10670
"deming, new mexico, united states","10,668",10668
"medicine hat, alberta, canada","10,668",10668
"bellmawr, new jersey, united states","10,665",10665
"fleetwood, pennsylvania, united states","10,660",10660
"huron, south dakota, united states","10,659",10659
"fermo, the marches, italy","10,658",10658
"campo bom, rio grande do sul, brazil","10,649",10649
"mystic, connecticut, united states","10,648",10648
"huntingdon valley, pennsylvania, united states","10,646",10646
"hot springs village, arkansas, united states","10,639",10639
"north bend, oregon, united states","10,635",10635
"summerville, georgia, united states","10,633",10633
"danville, indiana, united states","10,631",10631
"chino valley, arizona, united states","10,627",10627
"north liberty, iowa, united states","10,626",10626
"murphysboro, illinois, united states","10,623",10623
"somers point, new jersey, united states","10,622",10622
"vernon, louisiana, united states","10,622",10622
"palos heights, illinois, united states","10,616",10616
"marathon, florida, united states","10,615",10615
"rehovot, central district, israel","10,615",10615
"ladera ranch, california, united states","10,613",10613
"mercer, pennsylvania, united states","10,612",10612
"haymarket, virginia, united states","10,611",10611
"alamo, texas, united states","10,605",10605
"livingston, montana, united states","10,605",10605
"belle chasse, louisiana, united states","10,601",10601
"hollis, new york, united states","10,594",10594
"brookfield, connecticut, united states","10,591",10591
"vicosa, minas gerais, brazil","10,591",10591
"holden, massachusetts, united states","10,587",10587
"rio rico, arizona, united states","10,587",10587
"platteville, wisconsin, united states","10,580",10580
"wyandanch, new york, united states","10,580",10580
"middle island, new york, united states","10,577",10577
"rehoboth beach, delaware, united states","10,573",10573
"olney, illinois, united states","10,569",10569
"trenton, ohio, united states","10,566",10566
"floresville, texas, united states","10,564",10564
"san anselmo, california, united states","10,562",10562
"southampton, massachusetts, united states","10,562",10562
"parlin, new jersey, united states","10,561",10561
"chemnitz, saxony, germany","10,558",10558
"shamokin, pennsylvania, united states","10,549",10549
"el campo, texas, united states","10,544",10544
"swanton, ohio, united states","10,542",10542
"woodmere, new york, united states","10,542",10542
"bartlett, tennessee, united states","10,535",10535
"clarion, pennsylvania, united states","10,531",10531
"madisonville, tennessee, united states","10,531",10531
"union, kentucky, united states","10,528",10528
"burley, idaho, united states","10,526",10526
"mckinleyville, california, united states","10,526",10526
"souderton, pennsylvania, united states","10,524",10524
"winsted, connecticut, united states","10,523",10523
"new albany, mississippi, united states","10,519",10519
"marshall, michigan, united states","10,516",10516
"woodland park, colorado, united states","10,508",10508
"taylorsville, utah, united states","10,505",10505
"seagoville, texas, united states","10,500",10500
"harvard, illinois, united states","10,499",10499
"maple, ontario, canada","10,496",10496
"roslyn, new york, united states","10,495",10495
"jefferson, alabama, united states","10,490",10490
"woodbury, new york, united states","10,487",10487
"calera, alabama, united states","10,485",10485
"albion, new york, united states","10,478",10478
"saint marys, pennsylvania, united states","10,477",10477
"adairsville, georgia, united states","10,472",10472
"saint johns, michigan, united states","10,472",10472
"sydney, nova scotia, canada","10,471",10471
"tamaqua, pennsylvania, united states","10,469",10469
"coon rapids, minnesota, united states","10,466",10466
"el jadida, el-jadida, morocco","10,466",10466
"keystone heights, florida, united states","10,464",10464
"harper woods, michigan, united states","10,463",10463
"newton center, massachusetts, united states","10,461",10461
"oristano, sardinia, italy","10,458",10458
"st augustine, florida, united states","10,458",10458
"arverne, new york, united states","10,453",10453
"knox, indiana, united states","10,443",10443
"burtonsville, maryland, united states","10,441",10441
"wise, virginia, united states","10,438",10438
"halle neustadt, saxony-anhalt, germany","10,437",10437
"north arlington, new jersey, united states","10,435",10435
"old hickory, tennessee, united states","10,431",10431
"chicago ridge, illinois, united states","10,420",10420
"west allis, wisconsin, united states","10,416",10416
"wimberley, texas, united states","10,413",10413
"wildwood, florida, united states","10,408",10408
"crest hill, illinois, united states","10,404",10404
"rocky point, new york, united states","10,404",10404
"sudbury, massachusetts, united states","10,400",10400
"duncan, south carolina, united states","10,398",10398
"manchester, kentucky, united states","10,396",10396
"sayre, pennsylvania, united states","10,396",10396
"las vegas, new mexico, united states","10,395",10395
"nesconset, new york, united states","10,394",10394
"round lake beach, illinois, united states","10,392",10392
"lajeado, rio grande do sul, brazil","10,388",10388
"sparta, michigan, united states","10,388",10388
"vail, colorado, united states","10,386",10386
"nueces, texas, united states","10,385",10385
"south river, new jersey, united states","10,381",10381
"pendleton, indiana, united states","10,377",10377
"colombo, parana, brazil","10,368",10368
"exeter, california, united states","10,363",10363
"montauban, midi-pyrenees, france","10,360",10360
"prospect, kentucky, united states","10,349",10349
"ridley park, pennsylvania, united states","10,349",10349
"iglesias, sardegna, italy","10,347",10347
"monticello, new york, united states","10,341",10341
"navsari, gujarat, india","10,338",10338
"hillsborough, florida, united states","10,337",10337
"fredericktown, missouri, united states","10,334",10334
"north reading, massachusetts, united states","10,333",10333
"salem, missouri, united states","10,331",10331
"yardley, pennsylvania, united states","10,325",10325
"greendale, wisconsin, united states","10,324",10324
"oakland, new jersey, united states","10,324",10324
"fairless hills, pennsylvania, united states","10,322",10322
"north bay, ontario, canada","10,322",10322
"los osos, california, united states","10,318",10318
"lucas do rio verde, mato grosso, brazil","10,318",10318
"new fairfield, connecticut, united states","10,318",10318
"emmett, idaho, united states","10,317",10317
"justice, illinois, united states","10,316",10316
"wakefield, rhode island, united states","10,316",10316
"joppa, maryland, united states","10,314",10314
"kewanee, illinois, united states","10,314",10314
"monaca, pennsylvania, united states","10,314",10314
"porter ranch, california, united states","10,312",10312
"huesca, aragon, spain","10,311",10311
"clinton, new york, united states","10,309",10309
"north aurora, illinois, united states","10,305",10305
"newton falls, ohio, united states","10,296",10296
"port neches, texas, united states","10,293",10293
"howard, maryland, united states","10,283",10283
"mukwonago, wisconsin, united states","10,282",10282
"ridgefield park, new jersey, united states","10,280",10280
"clifton, colorado, united states","10,279",10279
"grayson, georgia, united states","10,274",10274
"tecumseh, michigan, united states","10,268",10268
"north bend, washington, united states","10,267",10267
"solan, himachal pradesh, india","10,267",10267
"wareham, massachusetts, united states","10,265",10265
"buncombe, north carolina, united states","10,258",10258
"bremen, georgia, united states","10,257",10257
"palmer, alaska, united states","10,254",10254
"randleman, north carolina, united states","10,246",10246
"hennepin, minnesota, united states","10,245",10245
"saint bernard, louisiana, united states","10,245",10245
"fulton, georgia, united states","10,241",10241
"oneonta, alabama, united states","10,239",10239
"sallisaw, oklahoma, united states","10,239",10239
"rice lake, wisconsin, united states","10,236",10236
"skiatook, oklahoma, united states","10,236",10236
"bay saint louis, mississippi, united states","10,234",10234
"newport, oregon, united states","10,234",10234
"stanley, north carolina, united states","10,234",10234
"mansfield, nottinghamshire, united kingdom","10,232",10232
"elkins, west virginia, united states","10,224",10224
"swansea, massachusetts, united states","10,224",10224
"hickory hills, illinois, united states","10,222",10222
"pierce, washington, united states","10,219",10219
"westport, massachusetts, united states","10,218",10218
"paraiso, cartago, costa rica","10,216",10216
"grinnell, iowa, united states","10,205",10205
"rostock, mecklenburg-vorpommern, germany","10,203",10203
"new hope, pennsylvania, united states","10,202",10202
"kristianstad, skåne, sweden","10,201",10201
"bangalore, karnataka, india","10,198",10198
"columbiana, alabama, united states","10,194",10194
"chesterfield, michigan, united states","10,191",10191
"russellville, kentucky, united states","10,186",10186
"groveland, florida, united states","10,185",10185
"clinton, missouri, united states","10,184",10184
"greenville, alabama, united states","10,182",10182
"greenwood, arkansas, united states","10,181",10181
"ballarat, victoria, australia","10,180",10180
"fletcher, north carolina, united states","10,178",10178
"punxsutawney, pennsylvania, united states","10,167",10167
"crawley, west sussex, united kingdom","10,166",10166
"winchester, tennessee, united states","10,165",10165
"mullica hill, new jersey, united states","10,163",10163
"são pedro da aldeia, rio de janeiro, brazil","10,163",10163
"sweetwater, texas, united states","10,161",10161
"hampstead, maryland, united states","10,154",10154
"são bento do sul, santa catarina, brazil","10,143",10143
"crowley, louisiana, united states","10,142",10142
"fort hood, texas, united states","10,141",10141
"palmerton, pennsylvania, united states","10,140",10140
"palisades park, new jersey, united states","10,139",10139
"evans, colorado, united states","10,131",10131
"liberty, south carolina, united states","10,127",10127
"belchertown, massachusetts, united states","10,124",10124
"pleasantville, new york, united states","10,123",10123
"cruz alta, rio grande do sul, brazil","10,117",10117
"hartsdale, new york, united states","10,115",10115
"huntingtown, maryland, united states","10,115",10115
"galashiels, scottish borders, united kingdom","10,112",10112
"pontiac, illinois, united states","10,110",10110
"pennsville, new jersey, united states","10,109",10109
"budd lake, new jersey, united states","10,106",10106
"clearlake, california, united states","10,104",10104
"dulles, virginia, united states","10,104",10104
"cynthiana, kentucky, united states","10,101",10101
"vinton, virginia, united states","10,101",10101
"elmsford, new york, united states","10,099",10099
"heber springs, arkansas, united states","10,098",10098
"montoursville, pennsylvania, united states","10,097",10097
"greene, ohio, united states","10,094",10094
"stony point, new york, united states","10,093",10093
"schwenksville, pennsylvania, united states","10,092",10092
"ardmore, pennsylvania, united states","10,088",10088
"marechal cândido rondon, parana, brazil","10,085",10085
"kingsburg, california, united states","10,070",10070
"iron mountain, michigan, united states","10,069",10069
"knoxville, iowa, united states","10,067",10067
"bīdar, karnataka, india","10,064",10064
"ipoh, perak, malaysia","10,062",10062
"durham, new hampshire, united states","10,060",10060
"salem, new jersey, united states","10,058",10058
"rochelle, illinois, united states","10,056",10056
"shiliguri, west bengal, india","10,056",10056
"ambridge, pennsylvania, united states","10,053",10053
"carriere, mississippi, united states","10,052",10052
"clawson, michigan, united states","10,046",10046
"swampscott, massachusetts, united states","10,046",10046
"south haven, michigan, united states","10,041",10041
"waverly, ohio, united states","10,040",10040
"plymouth, wisconsin, united states","10,030",10030
"plattsmouth, nebraska, united states","10,028",10028
"fruita, colorado, united states","10,027",10027
"bonne terre, missouri, united states","10,023",10023
"dowagiac, michigan, united states","10,022",10022
"eastman, georgia, united states","10,014",10014
"new providence, new jersey, united states","10,014",10014
"garanhuns, pernambuco, brazil","10,013",10013
"franklin, georgia, united states","10,003",10003
"burkburnett, texas, united states","9,996",9996
"dibrugarh, assam, india","9,996",9996
"fayette, georgia, united states","9,992",9992
"verona, new jersey, united states","9,992",9992
"fort riley, kansas, united states","9,986",9986
"derwood, maryland, united states","9,982",9982
"boonville, indiana, united states","9,981",9981
"halmstad, halland, sweden","9,979",9979
"spencer, iowa, united states","9,969",9969
"cachoeira do sul, rio grande do sul, brazil","9,962",9962
"berrien springs, michigan, united states","9,961",9961
"egg harbor city, new jersey, united states","9,958",9958
"somersworth, new hampshire, united states","9,957",9957
"mount vernon, indiana, united states","9,948",9948
"central, south carolina, united states","9,947",9947
"oakland gardens, new york, united states","9,947",9947
"williamston, north carolina, united states","9,945",9945
"saratoga, new york, united states","9,944",9944
"waverly, iowa, united states","9,944",9944
"manorville, new york, united states","9,930",9930
"westwood, massachusetts, united states","9,926",9926
"eunice, louisiana, united states","9,923",9923
"lincolnshire, illinois, united states","9,920",9920
"quimper, bretagne, france","9,920",9920
"cherryville, north carolina, united states","9,917",9917
"santa rosa beach, florida, united states","9,917",9917
"tainan city, tainan, taiwan","9,916",9916
"florence, oregon, united states","9,915",9915
"sylva, north carolina, united states","9,915",9915
"honesdale, pennsylvania, united states","9,914",9914
"warrior, alabama, united states","9,914",9914
"sagar, madhya pradesh, india","9,913",9913
"marion, virginia, united states","9,912",9912
"andover, kansas, united states","9,905",9905
"delta, colorado, united states","9,905",9905
"smithville, tennessee, united states","9,905",9905
"olyphant, pennsylvania, united states","9,904",9904
"beech grove, indiana, united states","9,901",9901
"rio linda, california, united states","9,895",9895
"siler city, north carolina, united states","9,892",9892
"douglas, arizona, united states","9,891",9891
"cushing, oklahoma, united states","9,890",9890
"maiden, north carolina, united states","9,888",9888
"concordia, entre rios, argentina","9,885",9885
"brownsville, tennessee, united states","9,883",9883
"wood river, illinois, united states","9,883",9883
"kawasaki, kanagawa, japan","9,882",9882
"gladewater, texas, united states","9,877",9877
